{"PackageName": "azure-eventhub-checkpointstoreblob", "PackageVersion": "1.2.0", "ParserVersion": "0.3.28", "Language": "Python", "ReviewLines": [{"Tokens": [{"Kind": 0, "Value": "# Package is parsed using apiview-stub-generator(version:0.3.28), Python version: 3.10.12", "HasPrefixSpace": false, "HasSuffixSpace": false, "SkipDiff": true}], "IsContextEndLine": false, "LineId": "GLOBAL"}, {"Tokens": [], "IsContextEndLine": false}, {"Tokens": [], "IsContextEndLine": false}, {"Tokens": [{"Kind": 2, "Value": "namespace", "HasPrefixSpace": false, "HasSuffixSpace": true}, {"Kind": 0, "Value": "azure.eventhub.extensions.checkpointstoreblob", "HasPrefixSpace": false, "HasSuffixSpace": false, "SkipDiff": false, "NavigationDisplayName": "azure.eventhub.extensions.checkpointstoreblob", "RenderClasses": ["namespace"]}], "LineId": "azure.eventhub.extensions.checkpointstoreblob", "IsContextEndLine": false, "Children": [{"Tokens": [], "IsContextEndLine": false, "RelatedToLine": "azure.eventhub.extensions.checkpointstoreblob"}, {"Tokens": [{"Kind": 2, "Value": "class", "HasPrefixSpace": false, "HasSuffixSpace": true}, {"Kind": 0, "Value": "azure.eventhub.extensions.checkpointstoreblob.BlobCheckpointStore", "HasPrefixSpace": false, "HasSuffixSpace": false, "SkipDiff": false, "NavigationDisplayName": "BlobCheckpointStore", "RenderClasses": ["class"]}, {"Kind": 1, "Value": "(", "HasPrefixSpace": false, "HasSuffixSpace": false}, {"Kind": 3, "Value": "CheckpointStore", "HasPrefixSpace": false, "HasSuffixSpace": false}, {"Kind": 1, "Value": ")", "HasPrefixSpace": false, "HasSuffixSpace": false}, {"Kind": 1, "Value": ":", "HasPrefixSpace": false, "HasSuffixSpace": false}, {"Kind": 0, "Value": " ", "HasPrefixSpace": false, "HasSuffixSpace": false, "SkipDiff": false}, {"Kind": 2, "Value": "implements", "HasPrefixSpace": false, "HasSuffixSpace": true}, {"Kind": 3, "Value": "ContextManager", "HasPrefixSpace": false, "HasSuffixSpace": true}], "IsContextEndLine": false, "LineId": "azure.eventhub.extensions.checkpointstoreblob.BlobCheckpointStore", "Children": [{"Tokens": [], "IsContextEndLine": false, "RelatedToLine": "azure.eventhub.extensions.checkpointstoreblob.BlobCheckpointStore"}, {"Tokens": [{"Kind": 2, "Value": "def", "HasPrefixSpace": false, "HasSuffixSpace": true}, {"Kind": 0, "Value": "__init__", "HasPrefixSpace": false, "HasSuffixSpace": false, "SkipDiff": false, "RenderClasses": ["method"]}, {"Kind": 1, "Value": "(", "HasPrefixSpace": false, "HasSuffixSpace": false}], "IsContextEndLine": false, "LineId": "azure.eventhub.extensions.checkpointstoreblob.BlobCheckpointStore.__init__", "Children": [{"Tokens": [{"Kind": 0, "Value": "    self", "HasPrefixSpace": false, "HasSuffixSpace": false, "SkipDiff": false}, {"Kind": 1, "Value": ",", "HasPrefixSpace": false, "HasSuffixSpace": true}], "IsContextEndLine": false, "LineId": "azure.eventhub.extensions.checkpointstoreblob.BlobCheckpointStore.__init__.param(self)"}, {"Tokens": [{"Kind": 0, "Value": "    blob_account_url", "HasPrefixSpace": false, "HasSuffixSpace": false, "SkipDiff": false}, {"Kind": 1, "Value": ":", "HasPrefixSpace": false, "HasSuffixSpace": true}, {"Kind": 3, "Value": "str", "HasPrefixSpace": false, "HasSuffixSpace": false}, {"Kind": 1, "Value": ",", "HasPrefixSpace": false, "HasSuffixSpace": true}], "IsContextEndLine": false, "LineId": "azure.eventhub.extensions.checkpointstoreblob.BlobCheckpointStore.__init__.param(blob_account_url)"}, {"Tokens": [{"Kind": 0, "Value": "    container_name", "HasPrefixSpace": false, "HasSuffixSpace": false, "SkipDiff": false}, {"Kind": 1, "Value": ":", "HasPrefixSpace": false, "HasSuffixSpace": true}, {"Kind": 3, "Value": "str", "HasPrefixSpace": false, "HasSuffixSpace": false}, {"Kind": 1, "Value": ",", "HasPrefixSpace": false, "HasSuffixSpace": true}], "IsContextEndLine": false, "LineId": "azure.eventhub.extensions.checkpointstoreblob.BlobCheckpointStore.__init__.param(container_name)"}, {"Tokens": [{"Kind": 0, "Value": "    credential", "HasPrefixSpace": false, "HasSuffixSpace": false, "SkipDiff": false}, {"Kind": 1, "Value": ":", "HasPrefixSpace": false, "HasSuffixSpace": true}, {"Kind": 3, "Value": "Optional", "HasPrefixSpace": false, "HasSuffixSpace": false}, {"Kind": 1, "Value": "[", "HasPrefixSpace": false, "HasSuffixSpace": false}, {"Kind": 3, "Value": "Union", "HasPrefixSpace": false, "HasSuffixSpace": false}, {"Kind": 1, "Value": "[", "HasPrefixSpace": false, "HasSuffixSpace": false}, {"Kind": 3, "Value": "AzureNamedKeyCredential", "HasPrefixSpace": false, "HasSuffixSpace": false}, {"Kind": 1, "Value": ", ", "HasPrefixSpace": false, "HasSuffixSpace": false}, {"Kind": 3, "Value": "AzureSasCredential", "HasPrefixSpace": false, "HasSuffixSpace": false}, {"Kind": 1, "Value": ", ", "HasPrefixSpace": false, "HasSuffixSpace": false}, {"Kind": 3, "Value": "TokenCredential", "HasPrefixSpace": false, "HasSuffixSpace": false}, {"Kind": 1, "Value": "]]", "HasPrefixSpace": false, "HasSuffixSpace": false}, {"Kind": 1, "Value": "=", "HasPrefixSpace": true, "HasSuffixSpace": true}, {"Kind": 6, "Value": "None", "HasPrefixSpace": false, "HasSuffixSpace": false, "SkipDiff": false}, {"Kind": 1, "Value": ",", "HasPrefixSpace": false, "HasSuffixSpace": true}], "IsContextEndLine": false, "LineId": "azure.eventhub.extensions.checkpointstoreblob.BlobCheckpointStore.__init__.param(credential)"}, {"Tokens": [{"Kind": 0, "Value": "    *", "HasPrefixSpace": false, "HasSuffixSpace": false, "SkipDiff": false}, {"Kind": 1, "Value": ",", "HasPrefixSpace": false, "HasSuffixSpace": true}], "IsContextEndLine": false, "LineId": "azure.eventhub.extensions.checkpointstoreblob.BlobCheckpointStore.__init__.param(*)"}, {"Tokens": [{"Kind": 0, "Value": "    api_version", "HasPrefixSpace": false, "HasSuffixSpace": false, "SkipDiff": false}, {"Kind": 1, "Value": ":", "HasPrefixSpace": false, "HasSuffixSpace": true}, {"Kind": 3, "Value": "str", "HasPrefixSpace": false, "HasSuffixSpace": false}, {"Kind": 1, "Value": "=", "HasPrefixSpace": true, "HasSuffixSpace": true}, {"Kind": 5, "Value": "\"2019-07-07\"", "HasPrefixSpace": false, "HasSuffixSpace": false}, {"Kind": 1, "Value": ",", "HasPrefixSpace": false, "HasSuffixSpace": true}], "IsContextEndLine": false, "LineId": "azure.eventhub.extensions.checkpointstoreblob.BlobCheckpointStore.__init__.param(api_version)"}, {"Tokens": [{"Kind": 0, "Value": "    secondary_hostname", "HasPrefixSpace": false, "HasSuffixSpace": false, "SkipDiff": false}, {"Kind": 1, "Value": ":", "HasPrefixSpace": false, "HasSuffixSpace": true}, {"Kind": 3, "Value": "Optional", "HasPrefixSpace": false, "HasSuffixSpace": false}, {"Kind": 1, "Value": "[", "HasPrefixSpace": false, "HasSuffixSpace": false}, {"Kind": 3, "Value": "str", "HasPrefixSpace": false, "HasSuffixSpace": false}, {"Kind": 1, "Value": "]", "HasPrefixSpace": false, "HasSuffixSpace": false}, {"Kind": 1, "Value": "=", "HasPrefixSpace": true, "HasSuffixSpace": true}, {"Kind": 6, "Value": "...", "HasPrefixSpace": false, "HasSuffixSpace": false, "SkipDiff": false}, {"Kind": 1, "Value": ",", "HasPrefixSpace": false, "HasSuffixSpace": true}], "IsContextEndLine": false, "LineId": "azure.eventhub.extensions.checkpointstoreblob.BlobCheckpointStore.__init__.param(secondary_hostname)"}, {"Tokens": [{"Kind": 0, "Value": "    **kwargs", "HasPrefixSpace": false, "HasSuffixSpace": false, "SkipDiff": false}, {"Kind": 1, "Value": ":", "HasPrefixSpace": false, "HasSuffixSpace": true}, {"Kind": 3, "Value": "Any", "HasPrefixSpace": false, "HasSuffixSpace": false}], "IsContextEndLine": false, "LineId": "azure.eventhub.extensions.checkpointstoreblob.BlobCheckpointStore.__init__.param(kwargs)"}, {"Tokens": [{"Kind": 1, "Value": ")", "HasPrefixSpace": false, "HasSuffixSpace": false}, {"Kind": 1, "Value": "->", "HasPrefixSpace": true, "HasSuffixSpace": true}, {"Kind": 3, "Value": "None", "HasPrefixSpace": false, "HasSuffixSpace": false}, {"Kind": 1, "Value": ": ...", "HasPrefixSpace": false, "HasSuffixSpace": false}], "IsContextEndLine": false, "LineId": "azure.eventhub.extensions.checkpointstoreblob.BlobCheckpointStore.__init__.returntype"}]}, {"Tokens": [], "IsContextEndLine": true, "RelatedToLine": "azure.eventhub.extensions.checkpointstoreblob.BlobCheckpointStore.__init__"}, {"Tokens": [{"Kind": 2, "Value": "@classmethod", "HasPrefixSpace": false, "HasSuffixSpace": false}], "IsContextEndLine": false, "RelatedToLine": "azure.eventhub.extensions.checkpointstoreblob.BlobCheckpointStore.from_connection_string"}, {"Tokens": [{"Kind": 2, "Value": "def", "HasPrefixSpace": false, "HasSuffixSpace": true}, {"Kind": 0, "Value": "from_connection_string", "HasPrefixSpace": false, "HasSuffixSpace": false, "SkipDiff": false, "RenderClasses": ["method"]}, {"Kind": 1, "Value": "(", "HasPrefixSpace": false, "HasSuffixSpace": false}], "IsContextEndLine": false, "LineId": "azure.eventhub.extensions.checkpointstoreblob.BlobCheckpointStore.from_connection_string", "Children": [{"Tokens": [{"Kind": 0, "Value": "    cls", "HasPrefixSpace": false, "HasSuffixSpace": false, "SkipDiff": false}, {"Kind": 1, "Value": ",", "HasPrefixSpace": false, "HasSuffixSpace": true}], "IsContextEndLine": false, "LineId": "azure.eventhub.extensions.checkpointstoreblob.BlobCheckpointStore.from_connection_string.param(cls)"}, {"Tokens": [{"Kind": 0, "Value": "    conn_str", "HasPrefixSpace": false, "HasSuffixSpace": false, "SkipDiff": false}, {"Kind": 1, "Value": ":", "HasPrefixSpace": false, "HasSuffixSpace": true}, {"Kind": 3, "Value": "str", "HasPrefixSpace": false, "HasSuffixSpace": false}, {"Kind": 1, "Value": ",", "HasPrefixSpace": false, "HasSuffixSpace": true}], "IsContextEndLine": false, "LineId": "azure.eventhub.extensions.checkpointstoreblob.BlobCheckpointStore.from_connection_string.param(conn_str)"}, {"Tokens": [{"Kind": 0, "Value": "    container_name", "HasPrefixSpace": false, "HasSuffixSpace": false, "SkipDiff": false}, {"Kind": 1, "Value": ":", "HasPrefixSpace": false, "HasSuffixSpace": true}, {"Kind": 3, "Value": "str", "HasPrefixS